{
  "schema_version": "1.0",
  "company": {
    "ticker": "RELIANCE",
    "name": "RELIANCE",
    "sector": null,
    "screener_url": "https://www.screener.in/company/RELIANCE/consolidated/",
    "fiscal_year_end": "03"
  },
  "generated_at": "2026-07-01T09:54:51.778Z",
  "coverage": {
    "from": "Q1FY25",
    "to": "Q4FY26",
    "as_of": "2026-04-01"
  },
  "verification_window": {
    "latest_reported": "Q4FY26",
    "latest_reported_date": "2026-04-01",
    "note": "Outcomes verifiable only through the latest reported period; later targets are NYT."
  },
  "documents": [
    {
      "id": "q1fy25-presentation",
      "type": "presentation",
      "quarter": "Q1FY25",
      "date": "2024-08-01",
      "title": null,
      "url": null,
      "source": "Upload",
      "role": "both"
    },
    {
      "id": "q1fy25-transcript",
      "type": "transcript",
      "quarter": "Q1FY25",
      "date": "2024-07-01",
      "title": null,
      "url": null,
      "source": "Upload",
      "role": "both"
    },
    {
      "id": "q1fy26-presentation",
      "type": "presentation",
      "quarter": "Q1FY26",
      "date": "2025-07-01",
      "title": null,
      "url": null,
      "source": "Upload",
      "role": "both"
    },
    {
      "id": "q2fy25-presentation",
      "type": "presentation",
      "quarter": "Q2FY25",
      "date": "2024-10-01",
      "title": null,
      "url": null,
      "source": "Upload",
      "role": "both"
    },
    {
      "id": "q2fy25-transcript",
      "type": "transcript",
      "quarter": "Q2FY25",
      "date": "2024-10-01",
      "title": null,
      "url": null,
      "source": "Upload",
      "role": "both"
    },
    {
      "id": "q2fy26-presentation",
      "type": "presentation",
      "quarter": "Q2FY26",
      "date": "2025-10-01",
      "title": null,
      "url": null,
      "source": "Upload",
      "role": "both"
    },
    {
      "id": "q2fy26-transcript",
      "type": "transcript",
      "quarter": "Q2FY26",
      "date": "2025-10-01",
      "title": null,
      "url": null,
      "source": "Upload",
      "role": "both"
    },
    {
      "id": "q3fy25-presentation",
      "type": "presentation",
      "quarter": "Q3FY25",
      "date": "2025-01-01",
      "title": null,
      "url": null,
      "source": "Upload",
      "role": "both"
    },
    {
      "id": "q3fy25-transcript",
      "type": "transcript",
      "quarter": "Q3FY25",
      "date": "2025-01-01",
      "title": null,
      "url": null,
      "source": "Upload",
      "role": "both"
    },
    {
      "id": "q3fy26-presentation",
      "type": "presentation",
      "quarter": "Q3FY26",
      "date": "2026-01-01",
      "title": null,
      "url": null,
      "source": "Upload",
      "role": "both"
    },
    {
      "id": "q3fy26-transcript",
      "type": "transcript",
      "quarter": "Q3FY26",
      "date": "2026-01-01",
      "title": null,
      "url": null,
      "source": "Upload",
      "role": "both"
    },
    {
      "id": "q4fy25-presentation",
      "type": "presentation",
      "quarter": "Q4FY25",
      "date": "2025-04-01",
      "title": null,
      "url": null,
      "source": "Upload",
      "role": "both"
    },
    {
      "id": "q4fy25-transcript",
      "type": "transcript",
      "quarter": "Q4FY25",
      "date": "2025-04-01",
      "title": null,
      "url": null,
      "source": "Upload",
      "role": "both"
    },
    {
      "id": "q4fy26-presentation",
      "type": "presentation",
      "quarter": "Q4FY26",
      "date": "2026-04-01",
      "title": null,
      "url": null,
      "source": "Upload",
      "role": "both"
    }
  ],
  "promises": [
    {
      "id": "p001",
      "date": "2024-07-01",
      "quarter_context": "Q1FY25",
      "source_id": "q1fy25-transcript",
      "source_label": "Q1FY25 transcript",
      "category": "capacity",
      "promise": "Complete remaining 19 CBM wells by year end",
      "quote": "Limited 2020 balance wells are expected to be put online by the year",
      "metric": "13 CBM wells online by Dec 2024",
      "target": {
        "text": "13 CBM wells online by year end",
        "value": 13,
        "value_high": null,
        "unit": "wells",
        "period": "by Dec 2024"
      },
      "test_date": "2024",
      "confidence": "H",
      "actual": {
        "text": "21 wells connected to the production system by Q4 FY26",
        "value": 21,
        "unit": "wells",
        "source_id": "Q4FY26 · q4fy26-presentation · 2026-04-01",
        "source_date": "2026-04-01",
        "what_happened": "21 CBM wells connected to production system by Q4 FY26"
      },
      "status": "MET",
      "variance": {
        "absolute": 8,
        "pct": 61.5,
        "bps": null,
        "days": null,
        "text": "21 vs 13 wells"
      },
      "mgmt_explanation": null,
      "root_cause": null,
      "was_revised": false
    },
    {
      "id": "p002",
      "date": "2024-07-01",
      "quarter_context": "Q1FY25",
      "source_id": "q1fy25-transcript",
      "source_label": "Q1FY25 transcript",
      "category": "capacity",
      "promise": "Incremental 0.5 million standard cubic meters gas per day from new CBM wells",
      "quote": "we expect to see an incremental 0.5 million standard cubic meters gas per day from these wells",
      "metric": "CBM incremental gas production 0.5 MMSCMD",
      "target": {
        "text": "0.5 MMSCMD incremental gas from new wells",
        "value": 0.5,
        "value_high": null,
        "unit": "MMSCMD",
        "period": "by Dec 2024"
      },
      "test_date": "2024",
      "confidence": "H",
      "actual": {
        "text": "CBM incremental production from new wells reached 0.4 MMSCMD with 40 wells completed, second phase commenced",
        "value": 0.4,
        "unit": "MMSCMD",
        "source_id": "q4fy25-presentation",
        "source_date": "2025-04-01",
        "what_happened": "40 wells completed contributing 0.4 MMSCMD incremental production; second phase of 40 wells campaign started"
      },
      "status": "MISSED",
      "variance": {
        "absolute": -0.1,
        "pct": -20,
        "bps": null,
        "days": null,
        "text": "0.4 vs 0.5 MMSCMD"
      },
      "mgmt_explanation": null,
      "root_cause": null,
      "was_revised": false
    },
    {
      "id": "p003",
      "date": "2024-07-01",
      "quarter_context": "Q1FY25",
      "source_id": "q1fy25-transcript",
      "source_label": "Q1FY25 transcript",
      "category": "timeline",
      "promise": "Impact of tariff increase to be seen starting this quarter",
      "quote": "The impact will only be seen starting this quarter",
      "metric": "Tariff increase impact starting Q1FY25",
      "target": {
        "text": "Impact starting Q1FY25",
        "value": 1,
        "value_high": null,
        "unit": "quarter",
        "period": "Q1FY25"
      },
      "test_date": "2024-08-14",
      "confidence": "H",
      "actual": {
        "text": "Customer addition resumes after a transient impact from tariff hike",
        "value": null,
        "unit": null,
        "source_id": "q3fy25-presentation",
        "source_date": "2025-01-01",
        "what_happened": "Tariff hike impact seen as transient; customer additions resumed in Q3 FY25"
      },
      "status": "NYT",
      "variance": {
        "absolute": null,
        "pct": null,
        "bps": null,
        "days": null,
        "text": "in progress, not yet due"
      },
      "mgmt_explanation": null,
      "root_cause": null,
      "was_revised": false
    },
    {
      "id": "p004",
      "date": "2024-08-01",
      "quarter_context": "Q1FY25",
      "source_id": "q1fy25-presentation",
      "source_label": "Q1FY25 presentation",
      "category": "capacity",
      "promise": "55 Compressed Biogas plants operational by 2025",
      "quote": "Rapidly scaling up investments in bioenergy to reach 55 Compressed Biogas (CBG) plants by 2025",
      "metric": "55 CBG plants by 2025",
      "target": {
        "text": "55 CBG plants by 2025",
        "value": 55,
        "value_high": null,
        "unit": "plants",
        "period": "2025"
      },
      "test_date": "2025",
      "confidence": "H",
      "actual": {
        "text": "10 CBG plants operational ~ 195 TPD production capacity",
        "value": 10,
        "unit": "plants",
        "source_id": "Q4FY25 · q4fy25-presentation",
        "source_date": "2025-04-01",
        "what_happened": "10 CBG plants operational by Q4FY25; on track to deliver 55 plants"
      },
      "status": "MISSED",
      "variance": {
        "absolute": -45,
        "pct": -81.8,
        "bps": null,
        "days": null,
        "text": "10 vs 55 plants"
      },
      "mgmt_explanation": null,
      "root_cause": null,
      "was_revised": false
    },
    {
      "id": "p005",
      "date": "2024-08-01",
      "quarter_context": "Q1FY25",
      "source_id": "q1fy25-presentation",
      "source_label": "Q1FY25 presentation",
      "category": "capacity",
      "promise": "Advanced battery manufacturing facility with 30 GWh annual capacity to commence by 2H FY26",
      "quote": "Advanced battery manufacturing facility with 30 GWh annual capacity to commence by 2H next year",
      "metric": "Battery manufacturing capacity 30 GWh",
      "target": {
        "text": "30 GWh capacity by 2H FY26",
        "value": 30,
        "value_high": null,
        "unit": "GWh",
        "period": "2H FY26"
      },
      "test_date": null,
      "confidence": "H",
      "actual": {
        "text": "Achieved significant construction and engineering progress on-site for 40 GWh manufacturing capacity, production line equipment on track for installation",
        "value": 40,
        "unit": "GWh",
        "source_id": "q2fy26-presentation",
        "source_date": "2025-10-01",
        "what_happened": "Construction and engineering progressed for 40 GWh capacity; equipment installation on track"
      },
      "status": "MET",